{
  "title": "Never My Love",
  "artist": "The 5th Dimension",
  "bpm": 120,
  "source": "McGill Billboard + SALAMI",
  "sections": [
    {
      "id": "intro_1",
      "start_ms": 1985,
      "duration_ms": 18102,
      "chords": [
        "N",
        "N",
        "D:maj",
        "D:maj"
      ],
      "sectionType": "Intro",
      "sectionLetter": "A",
      "sectionFunction": "Introduction",
      "sectionLabel": "A",
      "tags": [
        "salami_annotated",
        "timing_confidence:high"
      ]
    },
    {
      "id": "verse_1",
      "start_ms": 20087,
      "duration_ms": 12094,
      "chords": [
        "D:maj",
        "G:maj",
        "G:maj",
        "G:maj",
        "G:maj"
      ],
      "sectionType": "Verse",
      "sectionLetter": "B",
      "sectionFunction": "MainTheme",
      "sectionLabel": "B",
      "tags": [
        "salami_annotated",
        "timing_confidence:high"
      ]
    },
    {
      "id": "chorus_1",
      "start_ms": 32182,
      "duration_ms": 24351,
      "chords": [
        "G:maj",
        "D:maj/3",
        "F:maj",
        "C:maj",
        "G:maj",
        "E:min",
        "G:maj7",
        "C:maj7",
        "G:maj"
      ],
      "sectionType": "Chorus",
      "sectionLetter": "C",
      "sectionFunction": "Hook",
      "sectionLabel": "C",
      "tags": [
        "salami_annotated",
        "timing_confidence:high"
      ]
    },
    {
      "id": "chorus_2",
      "start_ms": 56534,
      "duration_ms": 23631,
      "chords": [
        "G:maj",
        "D:maj/3",
        "F:maj",
        "C:maj",
        "G:maj",
        "E:min",
        "G:maj",
        "C:maj",
        "G:maj"
      ],
      "sectionType": "Chorus",
      "sectionLetter": "C",
      "sectionFunction": "Hook",
      "sectionLabel": "C",
      "tags": [
        "salami_annotated",
        "timing_confidence:high"
      ]
    },
    {
      "id": "bridge_1",
      "start_ms": 80165,
      "duration_ms": 21170,
      "chords": [
        "B:sus4(b7,9)",
        "B:7",
        "E:min7",
        "A:sus4(b7)",
        "A:7",
        "D:maj",
        "G:maj",
        "C:maj",
        "C:maj7",
        "C:maj6",
        "B:min",
        "D:maj/b7",
        "D:maj/b7"
      ],
      "sectionType": "Bridge",
      "sectionLetter": "D",
      "sectionFunction": "Development",
      "sectionLabel": "D",
      "tags": [
        "salami_annotated",
        "timing_confidence:high"
      ]
    },
    {
      "id": "chorus_3",
      "start_ms": 101336,
      "duration_ms": 23484,
      "chords": [
        "G:maj",
        "D:maj/3",
        "F:maj",
        "C:maj",
        "G:maj",
        "G:maj",
        "E:min",
        "G:maj",
        "D:maj7",
        "A:maj"
      ],
      "sectionType": "Chorus",
      "sectionLetter": "C",
      "sectionFunction": "Hook",
      "sectionLabel": "C",
      "tags": [
        "salami_annotated",
        "timing_confidence:high"
      ]
    },
    {
      "id": "chorus_4",
      "start_ms": 124820,
      "duration_ms": 23870,
      "chords": [
        "A:maj",
        "A:maj",
        "E:maj/3",
        "G:maj",
        "D:maj",
        "A:maj",
        "F#:min",
        "A:maj",
        "D:maj",
        "A:maj"
      ],
      "sectionType": "Chorus",
      "sectionLetter": "C",
      "sectionFunction": "Hook",
      "sectionLabel": "C'",
      "tags": [
        "salami_annotated",
        "timing_confidence:high"
      ]
    },
    {
      "id": "bridge_2",
      "start_ms": 148690,
      "duration_ms": 27574,
      "chords": [
        "C#:sus4(b7,9)",
        "C#:7",
        "F#:min7",
        "B:sus4(b7)",
        "B:7",
        "E:maj",
        "A:maj",
        "D:maj7",
        "D:maj6",
        "D:maj6",
        "C#:min7",
        "D:maj13",
        "D:maj13",
        "N"
      ],
      "sectionType": "Bridge",
      "sectionLetter": "D",
      "sectionFunction": "Development",
      "sectionLabel": "D'",
      "tags": [
        "salami_annotated",
        "timing_confidence:high"
      ]
    },
    {
      "id": "chorus_5",
      "start_ms": 176265,
      "duration_ms": 61579,
      "chords": [
        "N",
        "A:maj",
        "A:maj/b7",
        "F#:min",
        "F:maj",
        "G:maj",
        "A:maj",
        "A:maj/b7",
        "F#:min",
        "F:maj",
        "G:maj",
        "A:maj",
        "A:maj/b7",
        "F#:min",
        "F:maj",
        "G:maj",
        "A:maj",
        "A:maj/b7",
        "F#:min",
        "F:maj",
        "G:maj",
        "G:maj",
        "A:maj",
        "A:maj",
        "N",
        "N",
        "N",
        "N"
      ],
      "sectionType": "Chorus",
      "sectionLetter": "C",
      "sectionFunction": "Hook",
      "sectionLabel": "C",
      "tags": [
        "salami_annotated",
        "timing_confidence:high"
      ]
    }
  ]
}