{
  "title": "Tarzan Boy (From \"Teenage Mutant Ninja Turtles III\")",
  "artist": "Baltimora",
  "bpm": 120,
  "source": "McGill Billboard + SALAMI",
  "sections": [
    {
      "id": "other_1",
      "start_ms": 116,
      "duration_ms": 1381,
      "chords": [
        "N"
      ],
      "sectionType": "Other",
      "sectionLetter": "Z",
      "sectionFunction": "Development",
      "sectionLabel": "Z",
      "tags": [
        "salami_annotated",
        "timing_confidence:high"
      ]
    },
    {
      "id": "chorus_1",
      "start_ms": 1498,
      "duration_ms": 35758,
      "chords": [
        "F:maj",
        "C:maj",
        "D:min",
        "Bb:maj",
        "C:maj",
        "F:maj",
        "F:maj",
        "C:maj",
        "D:min",
        "Bb:maj",
        "C:maj",
        "F:maj",
        "F:maj",
        "C:maj",
        "D:min",
        "Bb:maj",
        "C:maj",
        "F:maj",
        "F:maj",
        "C:maj",
        "D:min",
        "Bb:maj",
        "C:maj",
        "F:maj"
      ],
      "sectionType": "Chorus",
      "sectionLetter": "C",
      "sectionFunction": "Hook",
      "sectionLabel": "C",
      "tags": [
        "salami_annotated",
        "timing_confidence:high"
      ]
    },
    {
      "id": "intro_1",
      "start_ms": 37257,
      "duration_ms": 35738,
      "chords": [
        "F:maj",
        "D:min",
        "Bb:maj",
        "C:maj",
        "D:min",
        "Bb:maj",
        "C:maj",
        "D:min",
        "Bb:maj",
        "C:maj",
        "C#:dim7",
        "D:min",
        "C:maj/3",
        "F:maj",
        "D:min",
        "Bb:maj",
        "C:maj",
        "D:min",
        "Bb:maj",
        "C:maj",
        "D:min",
        "Bb:maj",
        "C:maj",
        "C#:dim7",
        "D:min",
        "C:maj/3",
        "F:maj"
      ],
      "sectionType": "Intro",
      "sectionLetter": "A",
      "sectionFunction": "Introduction",
      "sectionLabel": "A",
      "tags": [
        "salami_annotated",
        "timing_confidence:high"
      ]
    },
    {
      "id": "verse_1",
      "start_ms": 72995,
      "duration_ms": 35773,
      "chords": [
        "F:maj",
        "F:maj",
        "C:maj",
        "D:min",
        "Bb:maj",
        "C:maj",
        "F:maj",
        "F:maj",
        "C:maj",
        "D:min",
        "Bb:maj",
        "C:maj",
        "F:maj",
        "F:maj",
        "C:maj",
        "D:min",
        "Bb:maj",
        "C:maj",
        "F:maj",
        "F:maj",
        "C:maj",
        "D:min",
        "Bb:maj",
        "C:maj",
        "F:maj"
      ],
      "sectionType": "Verse",
      "sectionLetter": "B",
      "sectionFunction": "MainTheme",
      "sectionLabel": "B",
      "tags": [
        "salami_annotated",
        "timing_confidence:high"
      ]
    },
    {
      "id": "prechorus_1",
      "start_ms": 108769,
      "duration_ms": 17899,
      "chords": [
        "F:maj",
        "Bb:maj",
        "C:maj",
        "Bb:maj",
        "C:maj",
        "Bb:maj",
        "C:maj",
        "D:min",
        "D:min"
      ],
      "sectionType": "PreChorus",
      "sectionLetter": "F",
      "sectionFunction": "Build",
      "sectionLabel": "F",
      "tags": [
        "salami_annotated",
        "timing_confidence:high"
      ]
    },
    {
      "id": "verse_2",
      "start_ms": 126669,
      "duration_ms": 17911,
      "chords": [
        "F:maj",
        "C:maj",
        "D:min",
        "Bb:maj",
        "C:maj",
        "F:maj",
        "F:maj",
        "C:maj",
        "D:min",
        "Bb:maj",
        "C:maj",
        "F:maj"
      ],
      "sectionType": "Verse",
      "sectionLetter": "B",
      "sectionFunction": "MainTheme",
      "sectionLabel": "B",
      "tags": [
        "salami_annotated",
        "timing_confidence:high"
      ]
    },
    {
      "id": "intro_2",
      "start_ms": 144580,
      "duration_ms": 35779,
      "chords": [
        "F:maj",
        "D:min",
        "Bb:maj",
        "C:maj",
        "D:min",
        "Bb:maj",
        "C:maj",
        "D:min",
        "Bb:maj",
        "C:maj",
        "C#:dim7",
        "D:min",
        "C:maj/3",
        "F:maj",
        "D:min",
        "Bb:maj",
        "C:maj",
        "D:min",
        "Bb:maj",
        "C:maj",
        "D:min",
        "Bb:maj",
        "C:maj",
        "C#:dim7",
        "D:min",
        "C:maj/3",
        "F:maj"
      ],
      "sectionType": "Intro",
      "sectionLetter": "A",
      "sectionFunction": "Introduction",
      "sectionLabel": "A",
      "tags": [
        "salami_annotated",
        "timing_confidence:high"
      ]
    },
    {
      "id": "prechorus_2",
      "start_ms": 180359,
      "duration_ms": 17882,
      "chords": [
        "F:maj",
        "Bb:maj",
        "C:maj",
        "Bb:maj",
        "C:maj",
        "Bb:maj",
        "C:maj",
        "D:min",
        "D:min"
      ],
      "sectionType": "PreChorus",
      "sectionLetter": "F",
      "sectionFunction": "Build",
      "sectionLabel": "F",
      "tags": [
        "salami_annotated",
        "timing_confidence:high"
      ]
    },
    {
      "id": "verse_3",
      "start_ms": 198242,
      "duration_ms": 26849,
      "chords": [
        "D:min",
        "F:maj",
        "C:maj",
        "D:min",
        "Bb:maj",
        "C:maj",
        "F:maj",
        "F:maj",
        "C:maj",
        "D:min",
        "Bb:maj",
        "C:maj",
        "F:maj",
        "F:maj",
        "C:maj",
        "D:min",
        "Bb:maj",
        "C:maj",
        "F:maj"
      ],
      "sectionType": "Verse",
      "sectionLetter": "B",
      "sectionFunction": "MainTheme",
      "sectionLabel": "B",
      "tags": [
        "salami_annotated",
        "timing_confidence:high"
      ]
    },
    {
      "id": "transition_1",
      "start_ms": 225092,
      "duration_ms": 7370,
      "chords": [
        "F:maj",
        "F:maj",
        "C:maj",
        "D:min",
        "Bb:maj",
        "C:maj",
        "F:maj",
        "F:maj",
        "N"
      ],
      "sectionType": "Transition",
      "sectionLetter": "E",
      "sectionFunction": "Transition",
      "sectionLabel": "E",
      "tags": [
        "salami_annotated",
        "timing_confidence:high"
      ]
    }
  ]
}