{
  "title": "Woman To Woman",
  "artist": "Shirley Brown",
  "bpm": 120,
  "source": "McGill Billboard + SALAMI",
  "sections": [
    {
      "id": "intro_1",
      "start_ms": 348,
      "duration_ms": 93231,
      "chords": [
        "Eb:maj7",
        "C:min",
        "Eb:maj7",
        "C:min",
        "Eb:maj7",
        "C:min",
        "Eb:maj7",
        "C:min",
        "Eb:maj7",
        "C:min",
        "Eb:maj7",
        "C:min",
        "Eb:maj7",
        "C:min",
        "Eb:maj7",
        "C:min",
        "Eb:maj7",
        "C:min",
        "Eb:maj7",
        "C:min",
        "Eb:maj7",
        "C:min",
        "Bb:sus4(b7,9)",
        "Bb:sus4(b7,9)"
      ],
      "sectionType": "Intro",
      "sectionLetter": "A",
      "sectionFunction": "Introduction",
      "sectionLabel": "A",
      "tags": [
        "salami_annotated",
        "timing_confidence:high"
      ]
    },
    {
      "id": "verse_1",
      "start_ms": 93579,
      "duration_ms": 34675,
      "chords": [
        "Bb:sus4(b7,9)",
        "Eb:maj7",
        "Ab:maj7",
        "Eb:maj7",
        "C:min",
        "Bb:min",
        "Ab:maj",
        "Eb:maj7",
        "Ab:maj7",
        "Eb:maj7",
        "Bb:sus4(b7,9)",
        "Bb:sus4(b7,9)"
      ],
      "sectionType": "Verse",
      "sectionLetter": "B",
      "sectionFunction": "MainTheme",
      "sectionLabel": "B",
      "tags": [
        "salami_annotated",
        "timing_confidence:high"
      ]
    },
    {
      "id": "verse_2",
      "start_ms": 128255,
      "duration_ms": 34639,
      "chords": [
        "Eb:maj7",
        "Ab:maj7",
        "Eb:maj7",
        "Ab:maj7",
        "Eb:maj7",
        "Ab:maj7",
        "Eb:maj7",
        "Bb:sus4(b7,9)",
        "Bb:sus4(b7,9)"
      ],
      "sectionType": "Verse",
      "sectionLetter": "B",
      "sectionFunction": "MainTheme",
      "sectionLabel": "B",
      "tags": [
        "salami_annotated",
        "timing_confidence:high"
      ]
    },
    {
      "id": "verse_3",
      "start_ms": 162895,
      "duration_ms": 34277,
      "chords": [
        "Bb:sus4(b7,9)",
        "Eb:maj7",
        "Ab:maj7",
        "Eb:maj7",
        "C:min",
        "Bb:min",
        "Ab:maj",
        "Eb:maj7",
        "Ab:maj7",
        "Eb:maj7",
        "Bb:sus4(b7,9)",
        "Bb:sus4(b7,9)"
      ],
      "sectionType": "Verse",
      "sectionLetter": "B",
      "sectionFunction": "MainTheme",
      "sectionLabel": "B",
      "tags": [
        "salami_annotated",
        "timing_confidence:high"
      ]
    },
    {
      "id": "verse_4",
      "start_ms": 197172,
      "duration_ms": 37668,
      "chords": [
        "Bb:sus4(b7,9)",
        "Eb:maj7",
        "Ab:maj7",
        "Eb:maj7",
        "C:min",
        "Bb:min",
        "Ab:maj",
        "Eb:maj7",
        "Ab:maj7",
        "Eb:maj7",
        "C:min",
        "Bb:min",
        "Ab:maj",
        "Eb:maj7",
        "Ab:maj7",
        "Ab:maj7",
        "N"
      ],
      "sectionType": "Verse",
      "sectionLetter": "B",
      "sectionFunction": "MainTheme",
      "sectionLabel": "B",
      "tags": [
        "salami_annotated",
        "timing_confidence:high"
      ]
    }
  ]
}