{
  "title": "I Wouldn't Have Missed It For The World",
  "artist": "Ronnie Milsap",
  "bpm": 120,
  "source": "McGill Billboard + SALAMI",
  "sections": [
    {
      "id": "intro_1",
      "start_ms": 441,
      "duration_ms": 8427,
      "chords": [
        "G:maj",
        "C:maj",
        "G:maj",
        "C:maj",
        "C:maj"
      ],
      "sectionType": "Intro",
      "sectionLetter": "A",
      "sectionFunction": "Introduction",
      "sectionLabel": "A",
      "tags": [
        "salami_annotated",
        "timing_confidence:high"
      ]
    },
    {
      "id": "verse_1",
      "start_ms": 8868,
      "duration_ms": 33522,
      "chords": [
        "C:maj",
        "A:min",
        "A:min",
        "G:maj",
        "G:maj",
        "C:maj7",
        "C:maj7",
        "G:maj",
        "G:maj",
        "E:min",
        "E:min",
        "C:maj",
        "C:maj",
        "A:min",
        "A:min",
        "D:maj",
        "C:maj",
        "B:min",
        "A:min"
      ],
      "sectionType": "Verse",
      "sectionLetter": "B",
      "sectionFunction": "MainTheme",
      "sectionLabel": "B",
      "tags": [
        "salami_annotated",
        "timing_confidence:high"
      ]
    },
    {
      "id": "chorus_1",
      "start_ms": 42390,
      "duration_ms": 35732,
      "chords": [
        "G:maj",
        "C:maj",
        "A:min",
        "D:maj",
        "B:7/3",
        "E:min",
        "E:min/b7",
        "A:min",
        "D:sus4",
        "G:maj",
        "C:maj",
        "A:min",
        "D:maj",
        "B:7/3",
        "E:min",
        "E:min/b7",
        "A:min",
        "D:sus4",
        "D:sus4",
        "D:sus4"
      ],
      "sectionType": "Chorus",
      "sectionLetter": "C",
      "sectionFunction": "Hook",
      "sectionLabel": "C",
      "tags": [
        "salami_annotated",
        "timing_confidence:high"
      ]
    },
    {
      "id": "intro_2",
      "start_ms": 78123,
      "duration_ms": 8348,
      "chords": [
        "D:sus4",
        "G:maj",
        "C:maj",
        "G:maj",
        "C:maj",
        "C:maj"
      ],
      "sectionType": "Intro",
      "sectionLetter": "A",
      "sectionFunction": "Introduction",
      "sectionLabel": "A",
      "tags": [
        "salami_annotated",
        "timing_confidence:high"
      ]
    },
    {
      "id": "verse_2",
      "start_ms": 86471,
      "duration_ms": 33523,
      "chords": [
        "A:min",
        "A:min",
        "G:maj",
        "G:maj",
        "C:maj7",
        "C:maj7",
        "G:maj",
        "G:maj",
        "E:min",
        "E:min",
        "C:maj",
        "C:maj",
        "A:min",
        "A:min",
        "D:maj",
        "C:maj",
        "B:min",
        "A:min"
      ],
      "sectionType": "Verse",
      "sectionLetter": "B",
      "sectionFunction": "MainTheme",
      "sectionLabel": "B",
      "tags": [
        "salami_annotated",
        "timing_confidence:high"
      ]
    },
    {
      "id": "chorus_2",
      "start_ms": 119995,
      "duration_ms": 35681,
      "chords": [
        "A:min",
        "G:maj",
        "C:maj",
        "A:min",
        "D:maj",
        "B:7/3",
        "E:min",
        "E:min/b7",
        "A:min",
        "D:sus4",
        "G:maj",
        "C:maj",
        "A:min",
        "D:maj",
        "B:7/3",
        "E:min",
        "E:min/b7",
        "A:min",
        "D:sus4",
        "D:sus4",
        "D:sus4"
      ],
      "sectionType": "Chorus",
      "sectionLetter": "C",
      "sectionFunction": "Hook",
      "sectionLabel": "C",
      "tags": [
        "salami_annotated",
        "timing_confidence:high"
      ]
    },
    {
      "id": "chorus_3",
      "start_ms": 155676,
      "duration_ms": 16773,
      "chords": [
        "G:maj",
        "C:maj",
        "A:min",
        "D:maj",
        "B:7/3",
        "E:min",
        "E:min/b7",
        "A:min",
        "D:sus4",
        "D:sus4"
      ],
      "sectionType": "Chorus",
      "sectionLetter": "C",
      "sectionFunction": "Hook",
      "sectionLabel": "C'",
      "tags": [
        "salami_annotated",
        "timing_confidence:high"
      ]
    },
    {
      "id": "chorus_4",
      "start_ms": 172450,
      "duration_ms": 18873,
      "chords": [
        "D:sus4",
        "G:maj",
        "C:maj",
        "A:min",
        "D:maj",
        "B:7/3",
        "E:min",
        "E:min/b7",
        "A:min",
        "D:sus4",
        "D:sus4"
      ],
      "sectionType": "Chorus",
      "sectionLetter": "C",
      "sectionFunction": "Hook",
      "sectionLabel": "C''",
      "tags": [
        "salami_annotated",
        "timing_confidence:high"
      ]
    },
    {
      "id": "other_1",
      "start_ms": 191323,
      "duration_ms": 24918,
      "chords": [
        "D:sus4",
        "G:maj",
        "C:maj",
        "A:min",
        "D:maj",
        "B:maj/3",
        "E:min",
        "E:min/b7",
        "A:min",
        "D:sus4",
        "D:sus4",
        "N",
        "N",
        "N"
      ],
      "sectionType": "Other",
      "sectionLetter": "f",
      "sectionFunction": "Development",
      "sectionLabel": "fadeout",
      "tags": [
        "salami_annotated",
        "timing_confidence:high"
      ]
    }
  ]
}