{
  "title": "Caught Up In The Rapture",
  "artist": "Anita Baker",
  "bpm": 120,
  "source": "McGill Billboard + SALAMI",
  "sections": [
    {
      "id": "intro_1",
      "start_ms": 394,
      "duration_ms": 21263,
      "chords": [
        "D:maj9",
        "F:maj/2",
        "A:min7",
        "C:sus4(b7,9,13)",
        "G:min7",
        "A:sus4(b7)",
        "D:maj9",
        "F:maj/2",
        "A:min7",
        "C:sus4(b7,9,13)",
        "G:min7",
        "A:sus4(b7)"
      ],
      "sectionType": "Intro",
      "sectionLetter": "A",
      "sectionFunction": "Introduction",
      "sectionLabel": "A",
      "tags": [
        "salami_annotated",
        "timing_confidence:high"
      ]
    },
    {
      "id": "verse_1",
      "start_ms": 21658,
      "duration_ms": 20996,
      "chords": [
        "D:maj7",
        "F#:min7",
        "G:maj7",
        "C:sus4(b7,9,13)",
        "D:maj7",
        "F#:min7",
        "G:maj7",
        "C:sus4(b7,9,13)"
      ],
      "sectionType": "Verse",
      "sectionLetter": "B",
      "sectionFunction": "MainTheme",
      "sectionLabel": "B",
      "tags": [
        "salami_annotated",
        "timing_confidence:high"
      ]
    },
    {
      "id": "chorus_1",
      "start_ms": 42655,
      "duration_ms": 21106,
      "chords": [
        "C:sus4(b7,9,13)",
        "C#:(b3,b7,11,9)",
        "F#:7",
        "B:min7",
        "E:7",
        "A:min",
        "D:7",
        "G:maj7",
        "C:13",
        "C#:(b3,b7,11,9)",
        "F#:7",
        "B:min7",
        "E:7",
        "A:sus4(b7,9)",
        "A:sus4(b7,9)"
      ],
      "sectionType": "Chorus",
      "sectionLetter": "C",
      "sectionFunction": "Hook",
      "sectionLabel": "C",
      "tags": [
        "salami_annotated",
        "timing_confidence:high"
      ]
    },
    {
      "id": "bridge_1",
      "start_ms": 63761,
      "duration_ms": 21015,
      "chords": [
        "A:sus4(b7,9)",
        "B:min7",
        "B:min7",
        "G:maj7",
        "E:min7",
        "F#:aug(b7)",
        "B:min7",
        "B:min7",
        "G:maj7",
        "E:min7",
        "A:sus4(b7)"
      ],
      "sectionType": "Bridge",
      "sectionLetter": "D",
      "sectionFunction": "Development",
      "sectionLabel": "D",
      "tags": [
        "salami_annotated",
        "timing_confidence:high"
      ]
    },
    {
      "id": "intro_2",
      "start_ms": 84776,
      "duration_ms": 10494,
      "chords": [
        "A:sus4(b7)",
        "D:maj9",
        "F:maj/2",
        "A:min7",
        "C:sus4(b7,9,13)",
        "G:min7",
        "A:sus4(b7)"
      ],
      "sectionType": "Intro",
      "sectionLetter": "A",
      "sectionFunction": "Introduction",
      "sectionLabel": "A",
      "tags": [
        "salami_annotated",
        "timing_confidence:high"
      ]
    },
    {
      "id": "verse_2",
      "start_ms": 95271,
      "duration_ms": 21014,
      "chords": [
        "D:maj7",
        "F#:min7",
        "G:maj7",
        "C:sus4(b7,9,13)",
        "D:maj7",
        "F#:min7",
        "G:maj7",
        "C:sus4(b7,9,13)"
      ],
      "sectionType": "Verse",
      "sectionLetter": "B",
      "sectionFunction": "MainTheme",
      "sectionLabel": "B",
      "tags": [
        "salami_annotated",
        "timing_confidence:high"
      ]
    },
    {
      "id": "chorus_2",
      "start_ms": 116285,
      "duration_ms": 21037,
      "chords": [
        "C:sus4(b7,9,13)",
        "C#:(b3,b7,11,9)",
        "F#:7",
        "B:min7",
        "E:7",
        "A:min",
        "D:7",
        "G:maj7",
        "C:13",
        "C#:(b3,b7,11,9)",
        "F#:7",
        "B:min7",
        "E:7",
        "A:sus4(b7,9)",
        "A:sus4(b7,9)"
      ],
      "sectionType": "Chorus",
      "sectionLetter": "C",
      "sectionFunction": "Hook",
      "sectionLabel": "C",
      "tags": [
        "salami_annotated",
        "timing_confidence:high"
      ]
    },
    {
      "id": "bridge_2",
      "start_ms": 137323,
      "duration_ms": 31544,
      "chords": [
        "A:sus4(b7,9)",
        "B:min7",
        "B:min7",
        "G:maj7",
        "E:min7",
        "F#:aug(b7)",
        "B:min7",
        "B:min7",
        "G:maj7",
        "E:min7",
        "F#:aug(b7)",
        "B:min7",
        "B:min7",
        "G:maj7",
        "E:min7",
        "A:sus4(b7)"
      ],
      "sectionType": "Bridge",
      "sectionLetter": "D",
      "sectionFunction": "Development",
      "sectionLabel": "D'",
      "tags": [
        "salami_annotated",
        "timing_confidence:high"
      ]
    },
    {
      "id": "intro_3",
      "start_ms": 168867,
      "duration_ms": 21033,
      "chords": [
        "D:maj9",
        "F:maj/2",
        "A:min7",
        "C:sus4(b7,9,13)",
        "G:min7",
        "A:sus4(b7)",
        "D:maj9",
        "F:maj/2",
        "A:min7",
        "C:sus4(b7,9,13)",
        "G:min7",
        "A:sus4(b7)"
      ],
      "sectionType": "Intro",
      "sectionLetter": "A",
      "sectionFunction": "Introduction",
      "sectionLabel": "A'",
      "tags": [
        "salami_annotated",
        "timing_confidence:high"
      ]
    },
    {
      "id": "chorus_3",
      "start_ms": 189901,
      "duration_ms": 21005,
      "chords": [
        "A:sus4(b7)",
        "C#:(b3,b7,11,9)",
        "F#:7",
        "B:min7",
        "E:7",
        "A:min",
        "D:7",
        "G:maj7",
        "C:13",
        "C#:(b3,b7,11,9)",
        "F#:7",
        "B:min7",
        "E:7",
        "A:sus4(b7,9)",
        "A:sus4(b7,9)"
      ],
      "sectionType": "Chorus",
      "sectionLetter": "C",
      "sectionFunction": "Hook",
      "sectionLabel": "C",
      "tags": [
        "salami_annotated",
        "timing_confidence:high"
      ]
    },
    {
      "id": "bridge_3",
      "start_ms": 210906,
      "duration_ms": 52616,
      "chords": [
        "A:sus4(b7,9)",
        "B:min7",
        "B:min7",
        "G:maj7",
        "E:min7",
        "F#:aug(b7)",
        "B:min7",
        "B:min7",
        "G:maj7",
        "E:min7",
        "F#:aug(b7)",
        "B:min7",
        "B:min7",
        "G:maj7",
        "E:min7",
        "F#:aug(b7)",
        "B:min7",
        "B:min7",
        "G:maj7",
        "E:min7",
        "F#:aug(b7)",
        "B:min7",
        "B:min7",
        "G:maj7",
        "E:min7",
        "F#:aug(b7)",
        "F#:aug(b7)"
      ],
      "sectionType": "Bridge",
      "sectionLetter": "D",
      "sectionFunction": "Development",
      "sectionLabel": "D''",
      "tags": [
        "salami_annotated",
        "timing_confidence:high"
      ]
    },
    {
      "id": "bridge_4",
      "start_ms": 263523,
      "duration_ms": 54047,
      "chords": [
        "B:min7",
        "B:min7",
        "G:maj7",
        "E:min7",
        "F#:aug(b7)",
        "B:min7",
        "B:min7",
        "G:maj7",
        "E:min7",
        "F#:aug(b7)",
        "B:min7",
        "B:min7",
        "G:maj7",
        "E:min7",
        "F#:aug(b7)",
        "B:min7",
        "B:min7",
        "G:maj7",
        "E:min7",
        "F#:aug(b7)",
        "F#:aug(b7)",
        "B:min7",
        "B:min7",
        "G:maj7",
        "E:min7",
        "F#:aug(b7)",
        "F#:aug(b7)",
        "N"
      ],
      "sectionType": "Bridge",
      "sectionLetter": "D",
      "sectionFunction": "Development",
      "sectionLabel": "D",
      "tags": [
        "salami_annotated",
        "timing_confidence:high"
      ]
    }
  ]
}