{
  "title": "Hot Child In The City",
  "artist": "Nick Gilder",
  "bpm": 120,
  "source": "McGill Billboard + SALAMI",
  "sections": [
    {
      "id": "intro_1",
      "start_ms": 302,
      "duration_ms": 9520,
      "chords": [
        "N",
        "N",
        "E:maj",
        "A:maj",
        "B:maj",
        "E:maj",
        "A:maj",
        "B:maj"
      ],
      "sectionType": "Intro",
      "sectionLetter": "A",
      "sectionFunction": "Introduction",
      "sectionLabel": "A",
      "tags": [
        "salami_annotated",
        "timing_confidence:high"
      ]
    },
    {
      "id": "intro_2",
      "start_ms": 9822,
      "duration_ms": 17249,
      "chords": [
        "E:maj",
        "A:maj",
        "B:maj",
        "E:maj",
        "A:maj",
        "B:maj",
        "E:maj",
        "A:maj",
        "B:maj",
        "E:maj",
        "A:maj",
        "B:maj"
      ],
      "sectionType": "Intro",
      "sectionLetter": "A",
      "sectionFunction": "Introduction",
      "sectionLabel": "A",
      "tags": [
        "salami_annotated",
        "timing_confidence:high"
      ]
    },
    {
      "id": "verse_1",
      "start_ms": 27071,
      "duration_ms": 17232,
      "chords": [
        "B:maj",
        "E:maj",
        "A:maj",
        "E:maj",
        "A:maj",
        "E:maj",
        "A:maj",
        "E:maj",
        "A:maj"
      ],
      "sectionType": "Verse",
      "sectionLetter": "B",
      "sectionFunction": "MainTheme",
      "sectionLabel": "B",
      "tags": [
        "salami_annotated",
        "timing_confidence:high"
      ]
    },
    {
      "id": "verse_2",
      "start_ms": 44303,
      "duration_ms": 17484,
      "chords": [
        "A:maj",
        "E:maj",
        "A:maj",
        "E:maj",
        "A:maj",
        "E:maj",
        "A:maj",
        "E:maj",
        "A:maj"
      ],
      "sectionType": "Verse",
      "sectionLetter": "B",
      "sectionFunction": "MainTheme",
      "sectionLabel": "B",
      "tags": [
        "salami_annotated",
        "timing_confidence:high"
      ]
    },
    {
      "id": "intro_3",
      "start_ms": 61788,
      "duration_ms": 17322,
      "chords": [
        "E:maj",
        "A:maj",
        "B:maj",
        "E:maj",
        "A:maj",
        "B:maj",
        "E:maj",
        "A:maj",
        "B:maj",
        "E:maj",
        "A:maj",
        "B:maj"
      ],
      "sectionType": "Intro",
      "sectionLetter": "A",
      "sectionFunction": "Introduction",
      "sectionLabel": "A",
      "tags": [
        "salami_annotated",
        "timing_confidence:high"
      ]
    },
    {
      "id": "verse_3",
      "start_ms": 79110,
      "duration_ms": 17298,
      "chords": [
        "B:maj",
        "E:maj",
        "A:maj",
        "E:maj",
        "A:maj",
        "E:maj",
        "A:maj",
        "E:maj",
        "A:maj"
      ],
      "sectionType": "Verse",
      "sectionLetter": "B",
      "sectionFunction": "MainTheme",
      "sectionLabel": "B",
      "tags": [
        "salami_annotated",
        "timing_confidence:high"
      ]
    },
    {
      "id": "verse_4",
      "start_ms": 96409,
      "duration_ms": 17391,
      "chords": [
        "E:maj",
        "A:maj",
        "E:maj",
        "A:maj",
        "E:maj",
        "A:maj",
        "E:maj",
        "A:maj",
        "A:maj"
      ],
      "sectionType": "Verse",
      "sectionLetter": "B",
      "sectionFunction": "MainTheme",
      "sectionLabel": "B",
      "tags": [
        "salami_annotated",
        "timing_confidence:high"
      ]
    },
    {
      "id": "chorus_1",
      "start_ms": 113800,
      "duration_ms": 17159,
      "chords": [
        "A:maj",
        "E:maj",
        "A:maj",
        "B:maj",
        "E:maj",
        "A:maj",
        "E:maj",
        "A:maj",
        "B:maj",
        "E:maj",
        "A:maj",
        "A:maj"
      ],
      "sectionType": "Chorus",
      "sectionLetter": "C",
      "sectionFunction": "Hook",
      "sectionLabel": "C",
      "tags": [
        "salami_annotated",
        "timing_confidence:high"
      ]
    },
    {
      "id": "bridge_1",
      "start_ms": 130960,
      "duration_ms": 19481,
      "chords": [
        "A:maj",
        "B:maj",
        "F#:min",
        "A:maj",
        "E:maj",
        "B:maj",
        "F#:min",
        "A:maj",
        "B:sus4(b7)",
        "B:sus4(b7)"
      ],
      "sectionType": "Bridge",
      "sectionLetter": "D",
      "sectionFunction": "Development",
      "sectionLabel": "D",
      "tags": [
        "salami_annotated",
        "timing_confidence:high"
      ]
    },
    {
      "id": "verse_5",
      "start_ms": 150442,
      "duration_ms": 17391,
      "chords": [
        "B:sus4(b7)",
        "E:maj",
        "A:maj",
        "E:maj",
        "A:maj",
        "E:maj",
        "A:maj",
        "E:maj",
        "A:maj"
      ],
      "sectionType": "Verse",
      "sectionLetter": "B",
      "sectionFunction": "MainTheme",
      "sectionLabel": "B",
      "tags": [
        "salami_annotated",
        "timing_confidence:high"
      ]
    },
    {
      "id": "verse_6",
      "start_ms": 167833,
      "duration_ms": 21632,
      "chords": [
        "A:maj",
        "E:maj",
        "A:maj",
        "E:maj",
        "A:maj",
        "E:maj",
        "A:maj",
        "E:maj",
        "A:maj",
        "E:maj",
        "E:maj",
        "N"
      ],
      "sectionType": "Verse",
      "sectionLetter": "B",
      "sectionFunction": "MainTheme",
      "sectionLabel": "B",
      "tags": [
        "salami_annotated",
        "timing_confidence:high"
      ]
    }
  ]
}