{
  "title": "I Want To Walk You Home",
  "artist": "Fats Domino",
  "bpm": 120,
  "source": "McGill Billboard + SALAMI",
  "sections": [
    {
      "id": "intro_1",
      "start_ms": 417,
      "duration_ms": 2283,
      "chords": [
        "Ab:7",
        "Ab:7"
      ],
      "sectionType": "Intro",
      "sectionLetter": "A",
      "sectionFunction": "Introduction",
      "sectionLabel": "A",
      "tags": [
        "salami_annotated",
        "timing_confidence:high"
      ]
    },
    {
      "id": "intro_2",
      "start_ms": 2701,
      "duration_ms": 32683,
      "chords": [
        "Ab:7",
        "Db:maj",
        "Db:maj",
        "Db:maj",
        "Db:maj",
        "Gb:maj",
        "Gb:maj",
        "Db:maj",
        "Db:maj",
        "Ab:7",
        "Gb:maj",
        "Db:maj",
        "Db:maj"
      ],
      "sectionType": "Intro",
      "sectionLetter": "A",
      "sectionFunction": "Introduction",
      "sectionLabel": "A",
      "tags": [
        "salami_annotated",
        "timing_confidence:high"
      ]
    },
    {
      "id": "intro_3",
      "start_ms": 35385,
      "duration_ms": 32174,
      "chords": [
        "Db:maj",
        "Db:maj",
        "Db:maj",
        "Db:maj",
        "Db:maj",
        "Gb:maj",
        "Gb:maj",
        "Db:maj",
        "Db:maj",
        "Ab:7",
        "Gb:maj",
        "Db:maj",
        "Db:maj"
      ],
      "sectionType": "Intro",
      "sectionLetter": "A",
      "sectionFunction": "Introduction",
      "sectionLabel": "A",
      "tags": [
        "salami_annotated",
        "timing_confidence:high"
      ]
    },
    {
      "id": "intro_4",
      "start_ms": 67559,
      "duration_ms": 31908,
      "chords": [
        "Db:maj",
        "Db:maj",
        "Db:maj",
        "Db:maj",
        "Gb:maj",
        "Gb:maj",
        "Db:maj",
        "Db:maj",
        "Ab:7",
        "Gb:maj",
        "Db:maj",
        "Db:maj"
      ],
      "sectionType": "Intro",
      "sectionLetter": "A",
      "sectionFunction": "Introduction",
      "sectionLabel": "A",
      "tags": [
        "salami_annotated",
        "timing_confidence:high"
      ]
    },
    {
      "id": "intro_5",
      "start_ms": 99468,
      "duration_ms": 31964,
      "chords": [
        "Db:maj",
        "Db:maj",
        "Db:maj",
        "Db:maj",
        "Gb:maj",
        "Gb:maj",
        "Db:maj",
        "Db:maj",
        "Ab:7",
        "Gb:maj",
        "Db:maj",
        "Db:maj"
      ],
      "sectionType": "Intro",
      "sectionLetter": "A",
      "sectionFunction": "Introduction",
      "sectionLabel": "A",
      "tags": [
        "salami_annotated",
        "timing_confidence:high"
      ]
    },
    {
      "id": "intro_6",
      "start_ms": 131433,
      "duration_ms": 10176,
      "chords": [
        "Db:maj",
        "Db:maj",
        "Db:maj",
        "Db:maj",
        "Db:maj",
        "N"
      ],
      "sectionType": "Intro",
      "sectionLetter": "A",
      "sectionFunction": "Introduction",
      "sectionLabel": "A",
      "tags": [
        "salami_annotated",
        "timing_confidence:high"
      ]
    }
  ]
}