{
  "title": "Living It Down",
  "artist": "Freddy Fender",
  "bpm": 120,
  "source": "McGill Billboard + SALAMI",
  "sections": [
    {
      "id": "intro_1",
      "start_ms": 284,
      "duration_ms": 11913,
      "chords": [
        "C:maj",
        "F:maj",
        "C:maj",
        "G:7",
        "G:7"
      ],
      "sectionType": "Intro",
      "sectionLetter": "A",
      "sectionFunction": "Introduction",
      "sectionLabel": "A",
      "tags": [
        "salami_annotated",
        "timing_confidence:high"
      ]
    },
    {
      "id": "verse_1",
      "start_ms": 12197,
      "duration_ms": 46408,
      "chords": [
        "G:7",
        "C:maj",
        "C:7",
        "F:maj",
        "F:maj",
        "C:maj",
        "D:7",
        "D:min7",
        "G:7",
        "C:maj",
        "C:7",
        "F:maj",
        "F:maj",
        "F#:dim7",
        "C:maj/5",
        "G:7",
        "F:maj",
        "C:maj",
        "G:7"
      ],
      "sectionType": "Verse",
      "sectionLetter": "B",
      "sectionFunction": "MainTheme",
      "sectionLabel": "B",
      "tags": [
        "salami_annotated",
        "timing_confidence:high"
      ]
    },
    {
      "id": "verse_2",
      "start_ms": 58606,
      "duration_ms": 46517,
      "chords": [
        "G:7",
        "C:maj",
        "C:7",
        "F:maj",
        "F:maj",
        "C:maj",
        "D:7",
        "D:min7",
        "G:7",
        "C:maj",
        "C:7",
        "F:maj",
        "F#:dim7",
        "C:maj/5",
        "G:7",
        "F:maj",
        "C:maj"
      ],
      "sectionType": "Verse",
      "sectionLetter": "B",
      "sectionFunction": "MainTheme",
      "sectionLabel": "B",
      "tags": [
        "salami_annotated",
        "timing_confidence:high"
      ]
    },
    {
      "id": "verse_3",
      "start_ms": 105124,
      "duration_ms": 50774,
      "chords": [
        "C:maj",
        "C:7",
        "F:maj",
        "F:maj",
        "C:maj",
        "D:7",
        "D:min7",
        "G:7",
        "C:maj",
        "C:7",
        "F:maj",
        "F:maj",
        "F#:dim7",
        "C:maj/5",
        "G:7",
        "F:maj",
        "C:maj",
        "C:maj",
        "N",
        "N",
        "N"
      ],
      "sectionType": "Verse",
      "sectionLetter": "B",
      "sectionFunction": "MainTheme",
      "sectionLabel": "B",
      "tags": [
        "salami_annotated",
        "timing_confidence:high"
      ]
    }
  ]
}