{
  "title": "Hocus Pocus",
  "artist": "Focus",
  "bpm": 120,
  "source": "McGill Billboard + SALAMI",
  "sections": [
    {
      "id": "intro_1",
      "start_ms": 278,
      "duration_ms": 21199,
      "chords": [
        "A:5",
        "A:5",
        "E:maj",
        "F:maj7",
        "C:maj",
        "C:maj",
        "Bb:maj",
        "A:min7/5",
        "A:5",
        "A:5",
        "E:maj",
        "F:maj",
        "D:maj",
        "D:maj",
        "B:maj",
        "E:maj",
        "A:5",
        "A:5",
        "E:maj",
        "F:maj7",
        "C:maj",
        "C:maj",
        "Bb:maj",
        "A:min7/5",
        "A:5",
        "A:5",
        "E:maj",
        "F:maj",
        "D:maj",
        "D:maj",
        "B:maj",
        "E:maj"
      ],
      "sectionType": "Intro",
      "sectionLetter": "A",
      "sectionFunction": "Introduction",
      "sectionLabel": "A",
      "tags": [
        "salami_annotated",
        "timing_confidence:high"
      ]
    },
    {
      "id": "intro_2",
      "start_ms": 21478,
      "duration_ms": 21157,
      "chords": [
        "A:5",
        "A:5",
        "E:maj",
        "F:maj7",
        "C:maj",
        "C:maj",
        "Bb:maj",
        "A:min7/5",
        "A:5",
        "A:5",
        "E:maj",
        "F:maj",
        "D:maj",
        "D:maj",
        "B:maj",
        "E:maj",
        "A:5",
        "A:5",
        "E:maj",
        "F:maj7",
        "C:maj",
        "C:maj",
        "Bb:maj",
        "A:min7/5",
        "A:5",
        "A:5",
        "E:maj",
        "F:maj",
        "D:maj",
        "D:maj",
        "B:maj",
        "E:maj"
      ],
      "sectionType": "Intro",
      "sectionLetter": "A",
      "sectionFunction": "Introduction",
      "sectionLabel": "A",
      "tags": [
        "salami_annotated",
        "timing_confidence:high"
      ]
    },
    {
      "id": "verse_1",
      "start_ms": 42635,
      "duration_ms": 10079,
      "chords": [
        "E:maj",
        "A:min",
        "C:maj",
        "D:maj",
        "D:maj",
        "D:min",
        "F:maj",
        "G:maj",
        "G:maj",
        "G:maj",
        "E:min7",
        "N",
        "N",
        "N",
        "N"
      ],
      "sectionType": "Verse",
      "sectionLetter": "B",
      "sectionFunction": "MainTheme",
      "sectionLabel": "B",
      "tags": [
        "salami_annotated",
        "timing_confidence:high"
      ]
    },
    {
      "id": "chorus_1",
      "start_ms": 52714,
      "duration_ms": 21681,
      "chords": [
        "N",
        "A:min7",
        "E:min7",
        "F:maj",
        "C:maj",
        "D:min",
        "A:min7",
        "B:maj",
        "E:maj",
        "A:min7",
        "E:min7",
        "F:maj",
        "C:maj",
        "D:min",
        "A:min7",
        "B:maj",
        "E:maj",
        "A:maj",
        "Bb:maj/7",
        "C:maj/6",
        "D:min/5",
        "E:min/4",
        "F:maj/3",
        "G:maj/2",
        "A:maj",
        "A:maj",
        "A:maj"
      ],
      "sectionType": "Chorus",
      "sectionLetter": "C",
      "sectionFunction": "Hook",
      "sectionLabel": "C",
      "tags": [
        "salami_annotated",
        "timing_confidence:high"
      ]
    },
    {
      "id": "intro_3",
      "start_ms": 74396,
      "duration_ms": 20726,
      "chords": [
        "A:maj",
        "A:5",
        "A:5",
        "E:maj",
        "F:maj7",
        "C:maj",
        "C:maj",
        "Bb:maj",
        "A:min7/5",
        "A:5",
        "A:5",
        "E:maj",
        "F:maj",
        "D:maj",
        "D:maj",
        "B:maj",
        "E:maj",
        "A:5",
        "A:5",
        "E:maj",
        "F:maj7",
        "C:maj",
        "C:maj",
        "Bb:maj",
        "A:min7/5",
        "A:5",
        "A:5",
        "E:maj",
        "F:maj",
        "D:maj",
        "D:maj",
        "B:maj",
        "E:maj"
      ],
      "sectionType": "Intro",
      "sectionLetter": "A",
      "sectionFunction": "Introduction",
      "sectionLabel": "A",
      "tags": [
        "salami_annotated",
        "timing_confidence:high"
      ]
    },
    {
      "id": "verse_2",
      "start_ms": 95122,
      "duration_ms": 10028,
      "chords": [
        "A:min",
        "C:maj",
        "D:maj",
        "D:maj",
        "D:min",
        "F:maj",
        "G:maj",
        "G:maj",
        "G:maj",
        "E:min7",
        "N",
        "N",
        "N",
        "N"
      ],
      "sectionType": "Verse",
      "sectionLetter": "B",
      "sectionFunction": "MainTheme",
      "sectionLabel": "B",
      "tags": [
        "salami_annotated",
        "timing_confidence:high"
      ]
    },
    {
      "id": "bridge_1",
      "start_ms": 105151,
      "duration_ms": 15872,
      "chords": [
        "A:min",
        "N",
        "N",
        "N",
        "N",
        "N",
        "N",
        "N",
        "N",
        "N",
        "N",
        "N",
        "N",
        "N",
        "N",
        "N"
      ],
      "sectionType": "Bridge",
      "sectionLetter": "D",
      "sectionFunction": "Development",
      "sectionLabel": "D",
      "tags": [
        "salami_annotated",
        "timing_confidence:high"
      ]
    },
    {
      "id": "intro_4",
      "start_ms": 121023,
      "duration_ms": 20621,
      "chords": [
        "N",
        "A:5",
        "A:5",
        "E:maj",
        "F:maj7",
        "C:maj",
        "C:maj",
        "Bb:maj",
        "A:min7/5",
        "A:5",
        "A:5",
        "E:maj",
        "F:maj",
        "D:maj",
        "D:maj",
        "B:maj",
        "E:maj",
        "A:5",
        "A:5",
        "E:maj",
        "F:maj7",
        "C:maj",
        "C:maj",
        "Bb:maj",
        "A:min7/5",
        "A:5",
        "A:5",
        "E:maj",
        "F:maj",
        "D:maj",
        "D:maj",
        "B:maj",
        "E:maj"
      ],
      "sectionType": "Intro",
      "sectionLetter": "A",
      "sectionFunction": "Introduction",
      "sectionLabel": "A",
      "tags": [
        "salami_annotated",
        "timing_confidence:high"
      ]
    },
    {
      "id": "verse_3",
      "start_ms": 141644,
      "duration_ms": 9936,
      "chords": [
        "E:maj",
        "A:min",
        "C:maj",
        "D:maj",
        "D:maj",
        "D:min",
        "F:maj",
        "G:maj",
        "G:maj",
        "G:maj",
        "E:min7",
        "N",
        "N",
        "N",
        "N"
      ],
      "sectionType": "Verse",
      "sectionLetter": "B",
      "sectionFunction": "MainTheme",
      "sectionLabel": "B",
      "tags": [
        "salami_annotated",
        "timing_confidence:high"
      ]
    },
    {
      "id": "chorus_2",
      "start_ms": 151580,
      "duration_ms": 20979,
      "chords": [
        "N",
        "A:min7",
        "E:min7",
        "F:maj",
        "C:maj",
        "D:min",
        "A:min7",
        "B:maj",
        "E:maj",
        "A:min7",
        "E:min7",
        "F:maj",
        "C:maj",
        "D:min",
        "A:min7",
        "B:maj",
        "E:maj",
        "A:maj",
        "Bb:maj/7",
        "C:maj/6",
        "D:min/5",
        "E:min/4",
        "F:maj/3",
        "G:maj/2",
        "A:maj",
        "A:maj",
        "A:maj"
      ],
      "sectionType": "Chorus",
      "sectionLetter": "C",
      "sectionFunction": "Hook",
      "sectionLabel": "C",
      "tags": [
        "salami_annotated",
        "timing_confidence:high"
      ]
    },
    {
      "id": "intro_5",
      "start_ms": 172560,
      "duration_ms": 20675,
      "chords": [
        "A:5",
        "A:5",
        "E:maj",
        "F:maj7",
        "C:maj",
        "C:maj",
        "Bb:maj",
        "A:min7/5",
        "A:5",
        "A:5",
        "E:maj",
        "F:maj",
        "D:maj",
        "D:maj",
        "B:maj",
        "E:maj",
        "A:5",
        "A:5",
        "E:maj",
        "F:maj7",
        "C:maj",
        "C:maj",
        "Bb:maj",
        "A:min7/5",
        "A:5",
        "A:5",
        "E:maj",
        "F:maj",
        "D:maj",
        "D:maj",
        "B:maj",
        "E:maj"
      ],
      "sectionType": "Intro",
      "sectionLetter": "A",
      "sectionFunction": "Introduction",
      "sectionLabel": "A",
      "tags": [
        "salami_annotated",
        "timing_confidence:high"
      ]
    },
    {
      "id": "verse_4",
      "start_ms": 193235,
      "duration_ms": 13497,
      "chords": [
        "E:maj",
        "A:min",
        "C:maj",
        "D:maj",
        "D:maj",
        "D:min",
        "F:maj",
        "G:maj",
        "G:maj",
        "G:maj",
        "E:min7",
        "N",
        "N",
        "N",
        "N",
        "A:min",
        "A:min",
        "N",
        "N",
        "N"
      ],
      "sectionType": "Verse",
      "sectionLetter": "B",
      "sectionFunction": "MainTheme",
      "sectionLabel": "B",
      "tags": [
        "salami_annotated",
        "timing_confidence:high"
      ]
    }
  ]
}