{
  "title": "Put Your Hand In The Hand",
  "artist": "Ocean",
  "bpm": 120,
  "source": "McGill Billboard + SALAMI",
  "sections": [
    {
      "id": "intro_1",
      "start_ms": 278,
      "duration_ms": 13948,
      "chords": [
        "N",
        "N",
        "N",
        "E:maj",
        "E:maj",
        "E:maj"
      ],
      "sectionType": "Intro",
      "sectionLetter": "A",
      "sectionFunction": "Introduction",
      "sectionLabel": "A",
      "tags": [
        "salami_annotated",
        "timing_confidence:high"
      ]
    },
    {
      "id": "verse_1",
      "start_ms": 14227,
      "duration_ms": 27943,
      "chords": [
        "E:maj",
        "B:maj",
        "F#:min7",
        "B:maj",
        "E:maj",
        "E:7",
        "A:maj",
        "A#:dim",
        "E:maj",
        "C#:min",
        "F#:min7",
        "A:maj",
        "E:maj",
        "A:maj",
        "E:maj",
        "B:maj"
      ],
      "sectionType": "Verse",
      "sectionLetter": "B",
      "sectionFunction": "MainTheme",
      "sectionLabel": "B",
      "tags": [
        "salami_annotated",
        "timing_confidence:high"
      ]
    },
    {
      "id": "verse_2",
      "start_ms": 42170,
      "duration_ms": 28234,
      "chords": [
        "E:maj",
        "B:maj",
        "F#:min7",
        "B:maj",
        "E:maj",
        "E:7",
        "A:maj",
        "A#:dim",
        "E:maj",
        "C#:min",
        "F#:min7",
        "A:maj",
        "E:maj",
        "A:maj",
        "E:maj"
      ],
      "sectionType": "Verse",
      "sectionLetter": "B",
      "sectionFunction": "MainTheme",
      "sectionLabel": "B",
      "tags": [
        "salami_annotated",
        "timing_confidence:high"
      ]
    },
    {
      "id": "verse_3",
      "start_ms": 70404,
      "duration_ms": 28053,
      "chords": [
        "E:maj",
        "A:maj",
        "E:maj",
        "B:min7",
        "E:maj",
        "A:maj",
        "A:7",
        "D:maj",
        "D#:dim",
        "A:maj",
        "F#:min",
        "B:min7",
        "D:maj",
        "A:maj",
        "D:maj",
        "A:maj",
        "E:maj"
      ],
      "sectionType": "Verse",
      "sectionLetter": "B",
      "sectionFunction": "MainTheme",
      "sectionLabel": "B",
      "tags": [
        "salami_annotated",
        "timing_confidence:high"
      ]
    },
    {
      "id": "verse_4",
      "start_ms": 98458,
      "duration_ms": 28185,
      "chords": [
        "A:maj",
        "E:maj",
        "E:7",
        "A:maj",
        "A:7",
        "D:maj",
        "D#:dim",
        "A:maj",
        "F#:min",
        "B:min7",
        "D:maj",
        "A:maj",
        "D:maj",
        "A:maj",
        "E:maj"
      ],
      "sectionType": "Verse",
      "sectionLetter": "B",
      "sectionFunction": "MainTheme",
      "sectionLabel": "B",
      "tags": [
        "salami_annotated",
        "timing_confidence:high"
      ]
    },
    {
      "id": "verse_5",
      "start_ms": 126643,
      "duration_ms": 28116,
      "chords": [
        "E:maj",
        "A:maj",
        "E:maj",
        "B:min7",
        "E:maj",
        "A:maj",
        "A:7",
        "D:maj",
        "D#:dim",
        "A:maj",
        "F#:min",
        "B:min7",
        "D:maj",
        "A:maj",
        "D:maj",
        "A:maj",
        "E:maj"
      ],
      "sectionType": "Verse",
      "sectionLetter": "B",
      "sectionFunction": "MainTheme",
      "sectionLabel": "B",
      "tags": [
        "salami_annotated",
        "timing_confidence:high"
      ]
    },
    {
      "id": "verse_6",
      "start_ms": 154760,
      "duration_ms": 21383,
      "chords": [
        "E:maj",
        "A:maj",
        "E:maj",
        "B:min7",
        "E:maj",
        "A:maj",
        "A:7",
        "D:maj",
        "D#:dim",
        "A:maj",
        "F#:min",
        "B:min7",
        "D:maj",
        "A:maj",
        "D:maj",
        "A:maj",
        "E:maj",
        "E:maj",
        "N"
      ],
      "sectionType": "Verse",
      "sectionLetter": "B",
      "sectionFunction": "MainTheme",
      "sectionLabel": "B",
      "tags": [
        "salami_annotated",
        "timing_confidence:high"
      ]
    }
  ]
}